{
  "schema_version": "1.0.0",
  "kind": "program-list",
  "source_revision": "8b9d05f2416ca883025fea87d1e49f34b0f05479",
  "source_files": {
    "pom.xml": "1daf24d610aef638e73d6942da56f251d5f00f88ec803d51329de46291c60573",
    "src/main/java/kr/sistack/board/common/Pagination.java": "484a19e438becd6e61a51bbc1740854dbe5b9f8fa4293e8d75ec7bc8d5e1f060",
    "src/main/java/kr/sistack/board/dao/CommonCodeDao.java": "bf17d511c55527f8169dec393d32c6b5366fb6468d9a0e9c477a89e38136d7cb",
    "src/main/java/kr/sistack/board/domain/Board.java": "f9b4b7b8f311ded09d10a36faae74b05079c30544c9643bfedb19e1b5f464b25",
    "src/main/java/kr/sistack/board/domain/BoardSearch.java": "7dcc4fa6feff06daac074e3c2f337310f0831b4d0cf0c2a050562e663c1f5b65",
    "src/main/java/kr/sistack/board/domain/CommonCode.java": "0dd95b9d8a38eee6440db4275e3029f1dc37a4ae21c05ae2809226c08abd43ea",
    "src/main/java/kr/sistack/board/domain/Menu.java": "4d3e73ac4f5494d8056d715c809bc1ae83053c2d1462dd879b251316c48e9ba2",
    "src/main/java/kr/sistack/board/mapper/BoardMapper.java": "7912db189d1060de0e3d4aa7add93f625cb14e446dcb7daa71241d616a88bcfa",
    "src/main/java/kr/sistack/board/mapper/MenuMapper.java": "cb950f3cb91faa8ca712669245e72bdc700ba03dd740f07f27cdc2668c282c2d",
    "src/main/java/kr/sistack/board/service/BoardService.java": "896a3dc32285cec3671382ce969adc1a2943a920852e5a696bcbd794e50ab10c",
    "src/main/java/kr/sistack/board/service/CommonCodeService.java": "0d6fb300d45ae00d5118fcf67d92401ce9943de8e5ff42a6e54de35ebb3d78fb",
    "src/main/java/kr/sistack/board/service/impl/BoardServiceImpl.java": "338abd3aa4a58c89144bfa7f13edd15b36439767a1092a583c65dda9b397b970",
    "src/main/java/kr/sistack/board/service/impl/CommonCodeServiceImpl.java": "898a9ee4acff5b5f53070f9ff89570355caa27ffc88a6b23905e11f82058d666",
    "src/main/java/kr/sistack/board/service/NotFoundException.java": "e8a5793405fd835c0160fe92f007e054bb0bb3801d74e558d2e782e6de11ef4e",
    "src/main/java/kr/sistack/board/web/AuthController.java": "99ce3a31f3e2cf37a3d5ccbf84f51480681326790daa5a890047f5834d67b908",
    "src/main/java/kr/sistack/board/web/BoardController.java": "227d0a21ed2932322e94453c3af9c6a6921076936ae759d3d4eed6c863de6e73",
    "src/main/java/kr/sistack/board/web/CommonCodeController.java": "ca74a2e20ad4210a950b5cee7ac3f05809552e4f497a37acada4d0e22b127a90",
    "src/main/java/kr/sistack/board/web/CommonExceptionHandler.java": "840c8a58e7cb490dc7bc1b5f00db2b7b6219329fb60f7a453822d33aeb55eb85",
    "src/main/java/kr/sistack/board/web/LoginInterceptor.java": "ffdc90cb080d3303862c8d9d1a53efbb50cb9437000311d2e409620f17ba3b1c",
    "src/main/java/kr/sistack/board/web/UserSession.java": "f30cf08b464a57b453a954aa2248825c13a21a113d840f88f7f58b1b58c557b1",
    "src/main/resources/db/oracle/ddl.sql": "2335077f19afe3f217e81e8abeb7d975e828e75441fafa01d8508febbac3f31a",
    "src/main/resources/globals.properties": "d7711f3c96e1f24042efd71f9d6ab71cec8f6a753f54f447a583954e9474bf08",
    "src/main/resources/mapper/BoardMapper.xml": "ad194be2f97e681dea017a28c62b6a1cbd22956ac0c4471c59d1c7963278c4c0",
    "src/main/resources/mapper/CommonCode.xml": "7d71ac52705051551532ce4f79b82c855f1b25b3abb255aaf4687e618786b388",
    "src/main/resources/mapper/CommonSql.xml": "69553bacb0b00e4fd092fe2131d271914b4703e8f91b5d0737fc9c6d983c21cc",
    "src/main/resources/spring/root-context.xml": "696a11db923fb70687a863faa44321f462b6f9a1969869b252bd46c711d5627c",
    "src/main/webapp/resources/board.js": "6b7d7a88bee42990012ee211c75b0457650d911b34ede84e7bfab0eaf9327709",
    "src/main/webapp/WEB-INF/spring/dispatcher-servlet.xml": "1e1a10e0ea9704c9cdf5fbede8668991194a9446128c0117c9db9e0d22c5296a",
    "src/main/webapp/WEB-INF/views/board/detail.jsp": "26103291f0f5df494de12dff45db92007cbaaac2c5152b3e6f75a61b2161e421",
    "src/main/webapp/WEB-INF/views/board/form.jsp": "8ed0c020451cfa8b84faab83d9c8631360af1eeaa32b07dd254eae7e274f14b9",
    "src/main/webapp/WEB-INF/views/board/list.jsp": "feee1bbf66ab87a91a8920595542f8ce218a300348f9efdfa2bc1f2660d224c0",
    "src/main/webapp/WEB-INF/views/code/list.jsp": "1e14d74bc30469867916e1ab8dfa45698925a640b6ac94e0cbdbbc540928eff4",
    "src/main/webapp/WEB-INF/views/common/header.jspf": "e8a7827af18324bc3939bbb85a881f8547d6456532902ff1351657f390bea1a1",
    "src/main/webapp/WEB-INF/views/common/menu.jspf": "2293c5b0676b6fd61cb382306cd103606a2c89979c77ab9afa86ad516417f8b5",
    "src/main/webapp/WEB-INF/views/common/paging.jspf": "9c8557458ed1b63afcb97ce3edfd10050403ec2dfc1db4bc26024d02e8982cfb",
    "src/main/webapp/WEB-INF/views/error.jsp": "9db004c8d2a00449cf3f8f124ee3d884318082b9945e40531a6887ed61bbc8ce",
    "src/main/webapp/WEB-INF/views/login.jsp": "0bdc3edbe5df9471c4bdb7182278070d64986ab3a0656bcb3e71f588446f8b16",
    "src/main/webapp/WEB-INF/web.xml": "d01994c45686c2d855a2ed3c887440c7ed3fe213eb1277b5e5e07cb00aa528e0"
  },
  "rows": [
    {
      "values": {
        "program_id": null,
        "program_name": null,
        "url": "/auth/login.do",
        "http_method": "GET",
        "screen": "src/main/webapp/WEB-INF/views/login.jsp",
        "controller": "kr.sistack.board.web.AuthController#login",
        "service": null,
        "mapper": null
      },
      "evidence": [
        {
          "file": "src/main/java/kr/sistack/board/web/AuthController.java",
          "line": 14
        },
        {
          "file": "src/main/java/kr/sistack/board/web/AuthController.java",
          "line": 15
        },
        {
          "file": "src/main/java/kr/sistack/board/web/AuthController.java",
          "line": 13
        },
        {
          "file": "src/main/java/kr/sistack/board/web/AuthController.java",
          "line": 19
        },
        {
          "file": "src/main/webapp/WEB-INF/spring/dispatcher-servlet.xml",
          "line": 18
        },
        {
          "file": "src/main/webapp/WEB-INF/spring/dispatcher-servlet.xml",
          "line": 19
        },
        {
          "file": "src/main/webapp/WEB-INF/spring/dispatcher-servlet.xml",
          "line": 20
        },
        {
          "file": "src/main/webapp/WEB-INF/views/login.jsp",
          "line": 1
        }
      ],
      "unverified": [
        "program_id",
        "program_name",
        "service",
        "mapper"
      ],
      "status": "LIKELY",
      "reason": "calls: static 호출 java.util.UUID.randomUUID의 구현이 외부 라이브러리 또는 미수집 소스에 있음"
    },
    {
      "values": {
        "program_id": null,
        "program_name": null,
        "url": "/auth/login.do",
        "http_method": "POST",
        "screen": null,
        "controller": "kr.sistack.board.web.AuthController#signIn",
        "service": null,
        "mapper": null
      },
      "evidence": [
        {
          "file": "src/main/java/kr/sistack/board/web/AuthController.java",
          "line": 22
        },
        {
          "file": "src/main/java/kr/sistack/board/web/AuthController.java",
          "line": 23
        },
        {
          "file": "src/main/java/kr/sistack/board/web/AuthController.java",
          "line": 13
        }
      ],
      "unverified": [
        "program_id",
        "program_name",
        "screen",
        "service",
        "mapper"
      ],
      "status": "LIKELY",
      "reason": "calls: static 호출 java.util.UUID.randomUUID의 구현이 외부 라이브러리 또는 미수집 소스에 있음"
    },
    {
      "values": {
        "program_id": null,
        "program_name": null,
        "url": "/auth/logout.do",
        "http_method": "POST",
        "screen": null,
        "controller": "kr.sistack.board.web.AuthController#logout",
        "service": null,
        "mapper": null
      },
      "evidence": [
        {
          "file": "src/main/java/kr/sistack/board/web/AuthController.java",
          "line": 40
        },
        {
          "file": "src/main/java/kr/sistack/board/web/AuthController.java",
          "line": 41
        },
        {
          "file": "src/main/java/kr/sistack/board/web/AuthController.java",
          "line": 13
        }
      ],
      "unverified": [
        "program_id",
        "program_name",
        "screen",
        "service",
        "mapper"
      ],
      "status": "CONFIRMED",
      "reason": "요청 선언과 CONFIRMED 연결만 수집; 계층 표시는 클래스명 관례"
    },
    {
      "values": {
        "program_id": null,
        "program_name": null,
        "url": "/board/list.do",
        "http_method": "GET",
        "screen": "src/main/webapp/WEB-INF/views/board/list.jsp",
        "controller": "kr.sistack.board.web.BoardController#list",
        "service": "kr.sistack.board.service.impl.BoardServiceImpl#list",
        "mapper": "kr.sistack.board.mapper.BoardMapper.count\nkr.sistack.board.mapper.BoardMapper.selectList"
      },
      "evidence": [
        {
          "file": "src/main/java/kr/sistack/board/web/BoardController.java",
          "line": 36
        },
        {
          "file": "src/main/java/kr/sistack/board/web/BoardController.java",
          "line": 37
        },
        {
          "file": "src/main/java/kr/sistack/board/web/BoardController.java",
          "line": 19
        },
        {
          "file": "src/main/java/kr/sistack/board/web/BoardController.java",
          "line": 38
        },
        {
          "file": "src/main/java/kr/sistack/board/service/impl/BoardServiceImpl.java",
          "line": 19
        },
        {
          "file": "src/main/java/kr/sistack/board/web/BoardController.java",
          "line": 21
        },
        {
          "file": "src/main/java/kr/sistack/board/web/BoardController.java",
          "line": 41
        },
        {
          "file": "src/main/webapp/WEB-INF/spring/dispatcher-servlet.xml",
          "line": 18
        },
        {
          "file": "src/main/webapp/WEB-INF/spring/dispatcher-servlet.xml",
          "line": 19
        },
        {
          "file": "src/main/webapp/WEB-INF/spring/dispatcher-servlet.xml",
          "line": 20
        },
        {
          "file": "src/main/webapp/WEB-INF/views/board/list.jsp",